{
  "$schema": "https://json-schema.org/draft/2020-12/schema",
  "$id": "https://github.com/remorser58/remorsearch_UX_QA/schemas/ux-page-read.v1.schema.json",
  "title": "UX Page Read v1",
  "description": "One render of one public URL in a fresh anonymous browser context: rung R3 of the public-page reader. Written by a render driver (drivers/web/read_page.mjs) or assembled from a capture in the researcher's own private window, and consumed by `ux_research.py ingest`, which accepts it only after an anonymous read of the same URL that did not stop. The render never types, clicks or presses keys; it only scrolls, keeps the browser's own identity and uses no stealth. A check of any kind, one that would clear by itself included, is reported and never solved or waited out: ingest refuses a capture with challenge markers or a waited_ms above 0, and records it as a stop for the whole site. A login form is reported, never used.",
  "type": "object",
  "required": ["schema_version", "url", "final_url", "status", "text", "context", "started_at", "finished_at"],
  "additionalProperties": false,
  "properties": {
    "schema_version": {"const": "ux-page-read.v1"},
    "url": {"type": "string", "format": "uri", "maxLength": 8192, "description": "the URL that was opened"},
    "final_url": {"type": "string", "format": "uri", "maxLength": 8192, "description": "the URL after redirects"},
    "status": {"type": "integer", "minimum": 0, "maximum": 999, "description": "HTTP status of the main document; 0 when unknown"},
    "redirects": {
      "type": "array",
      "maxItems": 20,
      "items": {
        "type": "object",
        "required": ["status", "url"],
        "additionalProperties": false,
        "properties": {
          "status": {"type": "integer"},
          "url": {"type": "string", "maxLength": 8192}
        }
      }
    },
    "title": {"type": "string", "maxLength": 2000, "description": "page title; empty when a check stops the render before content collection"},
    "lang": {"type": "string", "maxLength": 35, "description": "document language; empty when a check stops the render before content collection"},
    "text": {"type": "string", "maxLength": 409600, "description": "document.body.innerText after scrolling; at most 400 KB. Empty when any browser or human check stops the render."},
    "json_ld": {
      "type": "array",
      "maxItems": 10,
      "description": "JSON-LD blocks as parsed values or raw strings; at most 10 blocks and 1 MB in total. Empty when a check stops the render before content collection.",
      "items": {"type": ["object", "array", "string"]}
    },
    "meta": {
      "type": "object",
      "additionalProperties": false,
      "properties": {
        "description": {"type": "string", "maxLength": 2000},
        "og": {"type": "object", "additionalProperties": {"type": "string"}},
        "robots": {"type": "string", "description": "content of the robots meta tag"},
        "tdm_reservation": {"type": ["string", "null"], "description": "content of the tdm-reservation meta tag or header"}
      }
    },
    "challenge": {
      "type": "object",
      "required": ["interactive"],
      "additionalProperties": false,
      "properties": {
        "interactive": {"type": "boolean", "description": "an interactive human check (a widget, a press-and-hold, a picture puzzle) was on the page"},
        "markers": {"type": "array", "maxItems": 20, "items": {"type": "string", "maxLength": 100}}
      }
    },
    "login_form": {"type": "boolean", "description": "a password field was on the inspected page; false when a check stops the render before this inspection"},
    "context": {"const": "anonymous", "description": "a fresh context with no stored cookies or sign-in"},
    "waited_ms": {"type": "integer", "minimum": 0, "maximum": 15000,
                  "description": "time spent waiting for a check to clear. The bundled driver never waits and always writes 0; values above 0 from other captures remain refused by ingest."},
    "scrolls": {"type": "integer", "minimum": 0, "maximum": 50},
    "blocked_types": {"type": "array", "uniqueItems": true, "items": {"enum": ["image", "media", "font"]}},
    "device_id": {"type": "string"},
    "driver_version": {"type": "string"},
    "browser_connected": {"type": "boolean", "description": "Chromium was connected through REMORSEARCH_BROWSER_WS rather than launched by the driver"},
    "browser_version": {"type": "string", "description": "Chromium version reported by Playwright"},
    "playwright_client_version": {"type": "string", "description": "Playwright package version loaded by the driver"},
    "started_at": {"type": "string", "format": "date-time"},
    "finished_at": {"type": "string", "format": "date-time"}
  }
}
