{
  "schema_version": "ux-page-read.v1",
  "url": "{{URL}}",
  "final_url": "{{URL}}",
  "status": 200,
  "redirects": [],
  "title": "테스트 앱 게시판",
  "lang": "ko",
  "text": "잔액 알림이 늦게 와요\n\n자동 충전을 꺼 둔 상태에서 잔액이 부족해도 알림이 하루 늦게 옵니다. 개찰구에서 막히고 나서야 알림이 와서 뒤에 선 사람들에게 미안했어요.\n\n알림 설정 메뉴는 찾았지만 기준 금액을 바꾸는 칸이 너무 작아서 여러 번 다시 눌렀습니다. PAGE-READ-SENTINEL",
  "json_ld": [],
  "meta": {"description": "", "og": {}, "robots": "", "tdm_reservation": null},
  "challenge": {"interactive": false, "markers": []},
  "login_form": false,
  "context": "anonymous",
  "waited_ms": 0,
  "scrolls": 3,
  "blocked_types": ["image", "media", "font"],
  "device_id": "fixture-phone",
  "driver_version": "fixture",
  "started_at": "2026-09-21T08:00:00Z",
  "finished_at": "2026-09-21T08:00:04Z"
}
